{
  "format_version": 1,
  "receipt_id": "faraday-sherlock-link-synthetic-001",
  "created_at": "2026-09-09T00:00:00Z",
  "direction": "faraday_export_to_sherlock",
  "faraday_reference": {
    "kind": "evidence",
    "id": "evidence-synthetic-001",
    "run_receipt_sha256": "aaaaaaaaaaaaaaaaaaaaaaaaaaaaaaaaaaaaaaaaaaaaaaaaaaaaaaaaaaaaaaaa",
    "evidence_record_sha256": "bbbbbbbbbbbbbbbbbbbbbbbbbbbbbbbbbbbbbbbbbbbbbbbbbbbbbbbbbbbbbbbb",
    "claim_ceiling": "Association only in the synthetic fixture."
  },
  "sherlock_reference": {
    "case_id": "faraday-research-bridge",
    "kind": "assertion",
    "id": "assertion-synthetic-001",
    "artifact_sha256": "cccccccccccccccccccccccccccccccccccccccccccccccccccccccccccccccc"
  },
  "translation": {
    "summary_sha256": "dddddddddddddddddddddddddddddddddddddddddddddddddddddddddddddddd",
    "summary_locator": "exports/faraday/evidence-synthetic-001-summary.json",
    "summary_role": "immutable_faraday_summary",
    "known_limitations": [
      "Synthetic fixture only; this is not scientific evidence.",
      "Sherlock assertion preserves an investigative reference and cannot mutate Faraday state."
    ]
  },
  "authority_boundary": {
    "faraday_canonical_state_mutated": false,
    "sherlock_note_is_faraday_evidence": false,
    "publication_authorized": false,
    "review_promotion_authorized": false,
    "boundary_statement": "This receipt links Faraday and Sherlock records without merging authority or canonical state."
  }
}
